{
  "$schema": "../../mml.schema.json",
  "lab": "meta-lab",
  "version": "0.1.0-alpha",

  "identity": {
    "type": "function",
    "level": "meta",
    "responsibility": "Lab di funzione che produce semi cognitivi (seed.json + context.md + about.md + assertions.py + mml.json + transduction.md + ui_contract.json + skill_intent_map) per nuovi lab D-ND. Puo' usare preset di dominio come acceleratori, mai come output finale. Applica il modus al lab stesso (A8 ricorsiva) e gestisce il falsifier meta (M1-M9) sui template generati."
  },

  "kernel_refs": {
    "mmsp_entities": [
      "MMS_Master",
      "Aethelred_v3.1",
      "Morpheus_v1.0",
      "OCC_v1.0",
      "AWO_v2.5"
    ],
    "kernel_files": [
      "kernel/reference/Kernel_Semantico_Autopoietico_Reiterativo_KSAR.md",
      "kernel/reference/MMSP1/D-ND_PrimaryRules.md",
      "kernel/reference/MMSP1/00_Assioma_di_Invarianza_Ontologica.md",
      "kernel/reference/MMSP1/MMS_Master.md",
      "kernel/reference/mini_MMSP1/META_KERNEL_Condensato_v1.md"
    ],
    "condensato_axioms_used": ["A2", "A4", "A8", "A11", "A14", "A15"]
  },

  "skills_attive": {
    "processing_layer": [
      {
        "name": "scenario-projector",
        "source": ".claude/skills/scenario-projector.md",
        "trigger": "during domain analysis and leverage check",
        "rationale": "Per ogni dominio target proposto, il meta-lab proietta scenari di leverage vs scenari di non-leverage prima di generare il template. Discrimina se il dominio passa o va nel cimitero.",
        "category": "research"
      },
      {
        "name": "capture-insight",
        "source": ".claude/skills/capture-insight.md",
        "trigger": "during corpus and enzyme exploration",
        "rationale": "Cristallizza insight emergenti dall'analisi del dominio e dal recupero skill/enzimi per arricchire le tensioni iniziali del template.",
        "category": "cognitive"
      },
      {
        "name": "integrate-pattern",
        "source": ".claude/skills/integrate-pattern.md",
        "trigger": "during skill_retrieval and transduction",
        "rationale": "Integra pattern esistenti, skill e enzimi cognitivi per produrre il template del nuovo lab senza reinventare cio' che il sistema possiede gia'.",
        "category": "constructive"
      }
    ],
    "interface_layer": [
      {
        "name": "conductor",
        "source": "kernel/reference/skills/agent_skills_conductor.md",
        "trigger": "on cycle orchestration",
        "rationale": "Il meta-lab è orchestratore di processi che generano lab. Skill kernel-side per coordinamento.",
        "category": "orchestration"
      },
      {
        "name": "semantic-orchestrator",
        "source": "kernel/reference/skills/agent_skills_semantic-orchestrator.md",
        "trigger": "on prompt-system synthesis",
        "rationale": "La generazione di context.md del lab figlio è atto semantic-orchestration. Skill kernel-side.",
        "category": "orchestration"
      }
    ],
    "generation_layer": [
      {
        "name": "genesis",
        "source": "kernel/reference/skills/agent_skills_genesis.md",
        "trigger": "on seed and template scaffolding",
        "rationale": "Skill kernel-side primaria per generazione. Il meta-lab è di natura genesica.",
        "category": "constructive"
      },
      {
        "name": "factory",
        "source": "kernel/reference/skills/agent_skills_factory.md",
        "trigger": "on multi-template batch or domain family generation",
        "rationale": "Quando il meta-lab dovrà generare più template in batch, usa pattern factory senza contaminare i domini tra loro.",
        "category": "constructive"
      }
    ],
    "identity_layer": [
      {
        "name": "consapevolezza-condensato",
        "source": ".claude/skills/consapevolezza-condensato.md",
        "trigger": "on cycle init and before template verdict",
        "rationale": "Il meta-lab applica il modello D-ND nucleo come grammatica di tutto ciò che produce. Skill canonica per riconoscere assiomi proiettabili nel dominio target.",
        "category": "identity"
      }
    ],
    "runtime_patterns": [
      {
        "name": "cascata",
        "source": ".claude/skills/cascata.md",
        "trigger": "after every template generation",
        "rationale": "Quando il meta-lab genera un template, la cascata propaga: dentro il template, verso il sistema lab, verso le possibilità emergenti.",
        "category": "orchestration"
      },
      {
        "name": "cec",
        "source": ".claude/skills/cec.md",
        "trigger": "before declaring TEMPLATE_VALID",
        "rationale": "Crivello operativo D-ND: 6 passi per filtrare ipotesi. Valida che le tensioni iniziali del template siano davvero dipolari.",
        "category": "logic"
      },
      {
        "name": "autologica-operativa",
        "source": ".claude/skills/autologica-operativa.md",
        "trigger": "on every step of generation",
        "rationale": "Il meta-lab è A8, autologica del sistema applicata al sistema. Skill core invariante.",
        "category": "cognitive"
      },
      {
        "name": "eval",
        "source": ".claude/skills/eval.md",
        "trigger": "after assertions.py generated and before install",
        "rationale": "Verifica che le assertions del template generato siano davvero eseguibili (M2) e che il recupero skill non resti dichiarativo.",
        "category": "maintenance"
      }
    ]
  },

  "tools_custom": [
    {
      "name": "lab_template_generator",
      "path": "tools/lab_template_generator.py",
      "description": "Scrive il filesystem tree del lab figlio dato uno specs JSON. Validate-before-write richiede transduction.md, ui_contract.json e skill_intent_map_json oltre a MML layered. Atto deterministico — l'intelligenza è nell'agent, qui solo I/O.",
      "executable_inline": true
    },
    {
      "name": "lab_template_validator",
      "path": "tools/lab_template_validator.py",
      "description": "CLI front-end del falsifier meta-lab (M1-M9). Verdict trinario: TEMPLATE_VALID | TEMPLATE_NEEDS_REFINEMENT | DOMAIN_NOT_OF_LEVERAGE.",
      "executable_inline": true
    },
    {
      "name": "exp_regenerate_physics",
      "path": "tools/exp_regenerate_physics.py",
      "description": "Primo test del meta-lab: spec di rigenerazione physics dal corpus interno + ground truth signature per confronto post-cycle.",
      "executable_inline": true
    }
  ],

  "external_apis": [],

  "modus_invocation": {
    "cycle_pattern": "corpus_read → optional_preset_read → skill_archive_retrieval → enzyme_retrieval → skill_intent_map_synthesis → domain_analysis → tension_extraction → axiom_projection → seed_generation → context_md_synthesis → about_md_synthesis_bilingual → assertions_py_synthesis → mml_json_synthesis → transduction_md_synthesis → ui_contract_synthesis → generator_validate_specs → falsifier_meta(M1-M9) → verdict",
    "skill_invocation_strategy": "lazy",
    "fallback_provider_chain": ["codex-cli", "claude-cli", "openrouter"],
    "preferred_runtime": "any"
  },

  "conoscenza_lab": {
    "tensioni_attive_count": 6,
    "cycles_completed": 0,
    "last_finding": null,
    "last_cycle_ts": null,
    "domain_specific_notes": "Meta-lab Phase 1+1.5 in fase di scaffolding. Primo cycle vivo non ancora lanciato. Falsifier aggiornato a M1-M9; M7 richiede transduction.md + ui_contract.json sui nuovi template, M8 richiede skill/enzyme retrieval + skill_intent_map + MML layered, M9 richiede tab_strategy e value_artifact_contract per dashboard/readback domain-native. M8/M9 restano legacy-safe sui domini pre-M8/M9. Preset di dominio aggiunti come acceleratori opzionali in docs/templates/domain_presets/."
  },

  "_generated_by": "manual",
  "_generated_at": "2026-05-04T00:00:00Z"
}
